[
  {
    "id": "kosgeb-arge-01",
    "kurum": "KOSGEB",
    "destek_adi": "Ar-Ge, İnovasyon ve Endüstriyel Uygulama Destek Programı",
    "kategori": "Ar-Ge",
    "maksimum_tutar": 6000000,
    "basvuru_linki": "https://www.kosgeb.gov.tr/"
  },
  {
    "id": "ticaret-fuar-01",
    "kurum": "Ticaret Bakanlığı",
    "destek_adi": "Yurt Dışı Fuar Katılım Desteği",
    "kategori": "İhracat",
    "maksimum_tutar": 500000,
    "basvuru_linki": "https://ticaret.gov.tr/destekler"
  }
]
